{
  "schema_version": 1,
  "dictionary_version": "0.1.0-fixture.1",
  "sources": [
    {
      "source_id": "kotoba_fixture_original_cc0",
      "title": "Kotoba MVP original fixture entries",
      "source_type": "original",
      "author": "Kotoba project (AI-assisted draft; human review pending)",
      "license_spdx": "CC0-1.0",
      "license_url": "https://creativecommons.org/publicdomain/zero/1.0/",
      "original_url": null,
      "retrieved_at": null,
      "redistribution_allowed": true,
      "modification_allowed": true,
      "commercial_use_allowed": true,
      "attribution_required": false,
      "ai_assisted": true,
      "notes": "Created specifically for Kotoba tests. Must remain ai_draft until a qualified human Japanese-language reviewer approves it. No commercial dictionary was copied."
    }
  ],
  "entries": [
    {
      "entry_id": "entry_ame_rain_001", "headword": "雨",
      "forms": [{"text": "雨", "type": "primary", "common": true}, {"text": "あめ", "type": "kana", "common": true}],
      "readings": [{"kana": "あめ", "primary": true}], "parts_of_speech": ["noun"], "frequency_rank": 500,
      "editorial_level": "curated", "edit_status": "ai_draft",
      "senses": [{"sense_id": "sense_ame_rain_001", "order": 1, "definition_ja_simple": "空の雲から水のつぶが落ちてくる天気。", "usage_note_ja": "同じ読みの「飴」は食べ物。", "register": "neutral", "importance": "primary", "examples": [{"example_id": "example_ame_rain_001", "sentence": "午後から雨が降った。", "source_id": "kotoba_fixture_original_cc0", "audio_asset_id": null}], "relations": [{"entry_id": "entry_ame_candy_001", "relation_type": "easily_confused", "note_ja": "「雨」は天気で、「飴」は甘い食べ物。"}], "image_assets": [], "audio_assets": [], "source_ids": ["kotoba_fixture_original_cc0"], "review_status": "ai_draft"}],
      "source_ids": ["kotoba_fixture_original_cc0"], "review": {"status": "ai_draft", "reviewed_by": null, "reviewed_at": null, "notes": "Human review required."}, "created_at": "2026-07-22T00:00:00Z", "updated_at": "2026-07-22T00:00:00Z", "data_version": "0.1.0"
    },
    {
      "entry_id": "entry_ame_candy_001", "headword": "飴",
      "forms": [{"text": "飴", "type": "primary", "common": true}, {"text": "あめ", "type": "kana", "common": true}],
      "readings": [{"kana": "あめ", "primary": true}], "parts_of_speech": ["noun"], "frequency_rank": 6000,
      "editorial_level": "curated", "edit_status": "ai_draft",
      "senses": [{"sense_id": "sense_ame_candy_001", "order": 1, "definition_ja_simple": "砂糖などを固めて作る、甘い食べ物。", "usage_note_ja": "同じ読みの「雨」と漢字を区別する。", "register": "neutral", "importance": "primary", "examples": [{"example_id": "example_ame_candy_001", "sentence": "子どもに飴を一つあげた。", "source_id": "kotoba_fixture_original_cc0", "audio_asset_id": null}], "relations": [{"entry_id": "entry_ame_rain_001", "relation_type": "easily_confused", "note_ja": "「飴」は食べ物で、「雨」は空から水が降る天気。"}], "image_assets": [], "audio_assets": [], "source_ids": ["kotoba_fixture_original_cc0"], "review_status": "ai_draft"}],
      "source_ids": ["kotoba_fixture_original_cc0"], "review": {"status": "ai_draft", "reviewed_by": null, "reviewed_at": null, "notes": "Human review required."}, "created_at": "2026-07-22T00:00:00Z", "updated_at": "2026-07-22T00:00:00Z", "data_version": "0.1.0"
    },
    {
      "entry_id": "entry_au_meet_001", "headword": "会う",
      "forms": [{"text": "会う", "type": "primary", "common": true}, {"text": "あう", "type": "kana", "common": true}],
      "readings": [{"kana": "あう", "primary": true}], "parts_of_speech": ["verb-godan"], "frequency_rank": 200,
      "editorial_level": "curated", "edit_status": "ai_draft",
      "senses": [{"sense_id": "sense_au_meet_001", "order": 1, "definition_ja_simple": "人と同じ場所に行き、顔を合わせる。", "usage_note_ja": "人に会う場合に使う。", "register": "neutral", "importance": "primary", "examples": [{"example_id": "example_au_meet_001", "sentence": "駅で友達に会った。", "source_id": "kotoba_fixture_original_cc0", "audio_asset_id": null}], "relations": [{"entry_id": "entry_au_fit_001", "relation_type": "easily_confused", "note_ja": "「会う」は人と顔を合わせること。「合う」は二つのものが一致すること。"}, {"entry_id": "entry_au_encounter_001", "relation_type": "easily_confused", "note_ja": "「遭う」は好ましくない出来事を経験する場合に多い。"}], "image_assets": [], "audio_assets": [], "source_ids": ["kotoba_fixture_original_cc0"], "review_status": "ai_draft"}],
      "source_ids": ["kotoba_fixture_original_cc0"], "review": {"status": "ai_draft", "reviewed_by": null, "reviewed_at": null, "notes": "Human review required."}, "created_at": "2026-07-22T00:00:00Z", "updated_at": "2026-07-22T00:00:00Z", "data_version": "0.1.0"
    },
    {
      "entry_id": "entry_au_fit_001", "headword": "合う",
      "forms": [{"text": "合う", "type": "primary", "common": true}, {"text": "あう", "type": "kana", "common": true}],
      "readings": [{"kana": "あう", "primary": true}], "parts_of_speech": ["verb-godan"], "frequency_rank": 300,
      "editorial_level": "curated", "edit_status": "ai_draft",
      "senses": [{"sense_id": "sense_au_fit_001", "order": 1, "definition_ja_simple": "二つのものが同じになったり、よく似合ったりする。", "usage_note_ja": "大きさ、時間、考えなどが一致する場合に使う。", "register": "neutral", "importance": "primary", "examples": [{"example_id": "example_au_fit_001", "sentence": "この靴は足の大きさに合う。", "source_id": "kotoba_fixture_original_cc0", "audio_asset_id": null}], "relations": [{"entry_id": "entry_au_meet_001", "relation_type": "easily_confused", "note_ja": "「会う」は人と顔を合わせる意味。"}], "image_assets": [], "audio_assets": [], "source_ids": ["kotoba_fixture_original_cc0"], "review_status": "ai_draft"}],
      "source_ids": ["kotoba_fixture_original_cc0"], "review": {"status": "ai_draft", "reviewed_by": null, "reviewed_at": null, "notes": "Human review required."}, "created_at": "2026-07-22T00:00:00Z", "updated_at": "2026-07-22T00:00:00Z", "data_version": "0.1.0"
    },
    {
      "entry_id": "entry_au_encounter_001", "headword": "遭う",
      "forms": [{"text": "遭う", "type": "primary", "common": false}, {"text": "あう", "type": "kana", "common": true}],
      "readings": [{"kana": "あう", "primary": true}], "parts_of_speech": ["verb-godan"], "frequency_rank": 8000,
      "editorial_level": "curated", "edit_status": "ai_draft",
      "senses": [{"sense_id": "sense_au_encounter_001", "order": 1, "definition_ja_simple": "事故や災害など、好ましくない出来事を経験する。", "usage_note_ja": "被害に遭う、事故に遭う、のように使う。", "register": "neutral", "importance": "primary", "examples": [{"example_id": "example_au_encounter_001", "sentence": "旅行中に大雨に遭った。", "source_id": "kotoba_fixture_original_cc0", "audio_asset_id": null}], "relations": [{"entry_id": "entry_au_meet_001", "relation_type": "easily_confused", "note_ja": "「会う」は人と顔を合わせる意味で、普通は悪い出来事には使わない。"}], "image_assets": [], "audio_assets": [], "source_ids": ["kotoba_fixture_original_cc0"], "review_status": "ai_draft"}],
      "source_ids": ["kotoba_fixture_original_cc0"], "review": {"status": "ai_draft", "reviewed_by": null, "reviewed_at": null, "notes": "Human review required."}, "created_at": "2026-07-22T00:00:00Z", "updated_at": "2026-07-22T00:00:00Z", "data_version": "0.1.0"
    },
    {
      "entry_id": "entry_gakkou_001", "headword": "学校",
      "forms": [{"text": "学校", "type": "primary", "common": true}, {"text": "がっこう", "type": "kana", "common": true}],
      "readings": [{"kana": "がっこう", "primary": true}], "parts_of_speech": ["noun"], "frequency_rank": 400,
      "editorial_level": "curated", "edit_status": "ai_draft",
      "senses": [{"sense_id": "sense_gakkou_001", "order": 1, "definition_ja_simple": "先生から勉強を教わるために、子どもや学生が通う場所。", "usage_note_ja": "小学校、中学校、高校、大学などを広く指す。", "register": "neutral", "importance": "primary", "examples": [{"example_id": "example_gakkou_001", "sentence": "毎朝八時に学校へ行く。", "source_id": "kotoba_fixture_original_cc0", "audio_asset_id": null}], "relations": [], "image_assets": [], "audio_assets": [], "source_ids": ["kotoba_fixture_original_cc0"], "review_status": "ai_draft"}],
      "source_ids": ["kotoba_fixture_original_cc0"], "review": {"status": "ai_draft", "reviewed_by": null, "reviewed_at": null, "notes": "Human review required."}, "created_at": "2026-07-22T00:00:00Z", "updated_at": "2026-07-22T00:00:00Z", "data_version": "0.1.0"
    },
    {
      "entry_id": "entry_hashi_bridge_001", "headword": "橋",
      "forms": [{"text": "橋", "type": "primary", "common": true}, {"text": "はし", "type": "kana", "common": true}],
      "readings": [{"kana": "はし", "primary": true}], "parts_of_speech": ["noun"], "frequency_rank": 1200,
      "editorial_level": "curated", "edit_status": "ai_draft",
      "senses": [{"sense_id": "sense_hashi_bridge_001", "order": 1, "definition_ja_simple": "川や谷などの上を渡れるように作った道。", "usage_note_ja": "同じ読みの「箸」と漢字を区別する。", "register": "neutral", "importance": "primary", "examples": [{"example_id": "example_hashi_bridge_001", "sentence": "橋を渡って川の向こうへ行く。", "source_id": "kotoba_fixture_original_cc0", "audio_asset_id": null}], "relations": [{"entry_id": "entry_hashi_chopsticks_001", "relation_type": "easily_confused", "note_ja": "「橋」は渡る場所で、「箸」は食事の道具。"}], "image_assets": [], "audio_assets": [], "source_ids": ["kotoba_fixture_original_cc0"], "review_status": "ai_draft"}],
      "source_ids": ["kotoba_fixture_original_cc0"], "review": {"status": "ai_draft", "reviewed_by": null, "reviewed_at": null, "notes": "Human review required."}, "created_at": "2026-07-22T00:00:00Z", "updated_at": "2026-07-22T00:00:00Z", "data_version": "0.1.0"
    },
    {
      "entry_id": "entry_hashi_chopsticks_001", "headword": "箸",
      "forms": [{"text": "箸", "type": "primary", "common": true}, {"text": "はし", "type": "kana", "common": true}],
      "readings": [{"kana": "はし", "primary": true}], "parts_of_speech": ["noun"], "frequency_rank": 2200,
      "editorial_level": "curated", "edit_status": "ai_draft",